<!DOCTYPE librero
[
<!ELEMENT librero (libro)*>
<!ELEMENT libro (titulo,autor*,editorial)>
<!ELEMENT titulo (#PCDATA)>
<!ELEMENT autor (#PCDATA)>
<!ELEMENT editorial (#PCDATA)>
]>